"SBI_Code","SBI_Omschrijving","SBI_Code_6","SBI_Hoofd_Letter","SBI_Hoofd_Omschrijving"
"4631","Groothandel in groenten en fruit en in consumptie-aardappelen",463100,"G","Groot- en detailhandel, reparatie van auto’s "
"46311","Groothandel in groenten en fruit",463110,"G","Groot- en detailhandel, reparatie van auto’s "
"46312","Groothandel in consumptie-aardappelen",463120,"G","Groot- en detailhandel, reparatie van auto’s "
"4632","Groothandel in vlees en vleeswaren en in wild en gevogelte (niet levend)",463200,"G","Groot- en detailhandel, reparatie van auto’s "
"4633","Groothandel in zuivelproducten, spijsoliën en -vetten en eieren",463300,"G","Groot- en detailhandel, reparatie van auto’s "
"46331","Groothandel in zuivelproducten en spijsoliën en -vetten",463310,"G","Groot- en detailhandel, reparatie van auto’s "
"46332","Groothandel in eieren",463320,"G","Groot- en detailhandel, reparatie van auto’s "
"4634","Groothandel in dranken (geen zuivel)",463400,"G","Groot- en detailhandel, reparatie van auto’s "
"4635","Groothandel in tabaksproducten en rokersbenodigdheden",463500,"G","Groot- en detailhandel, reparatie van auto’s "
"4636","Groothandel in suiker, chocolade en suikerwerk",463600,"G","Groot- en detailhandel, reparatie van auto’s "
"4637","Groothandel in koffie, thee, cacao en specerijen (geen ruwe)",463700,"G","Groot- en detailhandel, reparatie van auto’s "
"4638","Groothandel in overige voedingsmiddelen en in overige grondstoffen en halffabrikaten voor de voedingsmiddelenindustrie",463800,"G","Groot- en detailhandel, reparatie van auto’s "
"46381","Groothandel in snacks ",463810,"G","Groot- en detailhandel, reparatie van auto’s "
"46382","Groothandel in vis, schaal- en weekdieren ",463820,"G","Groot- en detailhandel, reparatie van auto’s "
"46383","Gespecialiseerde groothandel in overige voedings- en genotmiddelen (rest)",463830,"G","Groot- en detailhandel, reparatie van auto’s "
"46384","Groothandel in bakkerijgrondstoffen ",463840,"G","Groot- en detailhandel, reparatie van auto’s "
"46389","Gespecialiseerde groothandel in overige grondstoffen en halffabrikaten voor de voedingsmiddelenindustrie (rest) ",463890,"G","Groot- en detailhandel, reparatie van auto’s "
"4639","Groothandel in voedings- en genotmiddelen algemeen assortiment",463900,"G","Groot- en detailhandel, reparatie van auto’s "
"464","Groothandel in consumentenartikelen (non-food)",464000,"G","Groot- en detailhandel, reparatie van auto’s "
"4641","Groothandel in kledingstoffen, fournituren en huishoudtextiel",464100,"G","Groot- en detailhandel, reparatie van auto’s "
"46411","Groothandel in kledingstoffen en fournituren",464110,"G","Groot- en detailhandel, reparatie van auto’s "
"46412","Groothandel in huishoudtextiel en beddengoed",464120,"G","Groot- en detailhandel, reparatie van auto’s "
"4642","Groothandel in kleding, schoenen en mode-artikelen",464200,"G","Groot- en detailhandel, reparatie van auto’s "
"46421","Groothandel in bovenkleding",464210,"G","Groot- en detailhandel, reparatie van auto’s "
"46422","Groothandel in werkkleding",464220,"G","Groot- en detailhandel, reparatie van auto’s "
"46423","Groothandel in onderkleding",464230,"G","Groot- en detailhandel, reparatie van auto’s "
"46424","Groothandel in schoenen",464240,"G","Groot- en detailhandel, reparatie van auto’s "
"46425","Groothandel in mode-artikelen",464250,"G","Groot- en detailhandel, reparatie van auto’s "
"46429","Groothandel in textielwaren algemeen assortiment",464290,"G","Groot- en detailhandel, reparatie van auto’s "
"4643","Groothandel in elektrische huishoudelijke apparatuur, audio- en videoapparatuur en fotografische en optische artikelen",464300,"G","Groot- en detailhandel, reparatie van auto’s "
"46431","Groothandel in witgoed ",464310,"G","Groot- en detailhandel, reparatie van auto’s "
"46432","Groothandel in elektrische huishoudelijke apparatuur (geen witgoed, audio en video)",464320,"G","Groot- en detailhandel, reparatie van auto’s "
"46433","Groothandel in audio- en video-apparatuur ",464330,"G","Groot- en detailhandel, reparatie van auto’s "
"46434","Groothandel in fotografische artikelen",464340,"G","Groot- en detailhandel, reparatie van auto’s "
"46435","Groothandel in beeld- en geluidsdragers",464350,"G","Groot- en detailhandel, reparatie van auto’s "
"46436","Groothandel in optische artikelen",464360,"G","Groot- en detailhandel, reparatie van auto’s "
"4644","Groothandel in glas, porselein en aardewerk en in reinigingsmiddelen ",464400,"G","Groot- en detailhandel, reparatie van auto’s "
"46441","Groothandel in glas, porselein en aardewerk",464410,"G","Groot- en detailhandel, reparatie van auto’s "
"46442","Groothandel in was-, poets- en reinigingsmiddelen",464420,"G","Groot- en detailhandel, reparatie van auto’s "
"4645","Groothandel in parfums en cosmetica",464500,"G","Groot- en detailhandel, reparatie van auto’s "
"4646","Groothandel in farmaceutische producten, medische instrumenten en orthopedische artikelen ",464600,"G","Groot- en detailhandel, reparatie van auto’s "
"46461","Groothandel in farmaceutische producten",464610,"G","Groot- en detailhandel, reparatie van auto’s "
"46462","Groothandel in medische en tandheelkundige instrumenten, verpleeg- en orthopedische artikelen en laboratoriumbenodigdheden",464620,"G","Groot- en detailhandel, reparatie van auto’s "
"4647","Groothandel in huismeubilair, woningtextiel, vloerbedekking en verlichting ",464700,"G","Groot- en detailhandel, reparatie van auto’s "
"46471","Groothandel in huismeubilair",464710,"G","Groot- en detailhandel, reparatie van auto’s "
"46472","Groothandel in woningtextiel en vloerbedekking",464720,"G","Groot- en detailhandel, reparatie van auto’s "
"46473","Groothandel in verlichtingsartikelen",464730,"G","Groot- en detailhandel, reparatie van auto’s "
"4648","Groothandel in juweliersartikelen en uurwerken",464800,"G","Groot- en detailhandel, reparatie van auto’s "
"4649","Groothandel in overige consumentenartikelen (non-food)",464900,"G","Groot- en detailhandel, reparatie van auto’s "
"46491","Groothandel in fietsen en bromfietsen",464910,"G","Groot- en detailhandel, reparatie van auto’s "
"46492","Groothandel in watersportartikelen",464920,"G","Groot- en detailhandel, reparatie van auto’s "
"46493","Groothandel in kampeerartikelen (geen caravans)",464930,"G","Groot- en detailhandel, reparatie van auto’s "
"46494","Groothandel in speelgoed",464940,"G","Groot- en detailhandel, reparatie van auto’s "
"46495","Groothandel in muziekinstrumenten",464950,"G","Groot- en detailhandel, reparatie van auto’s "
"46496","Groothandel in sportartikelen (geen watersport)",464960,"G","Groot- en detailhandel, reparatie van auto’s "
"46497","Groothandel in papier- en kartonwaren (geen verpakkingsmateriaal)",464970,"G","Groot- en detailhandel, reparatie van auto’s "
"46498","Groothandel in boeken, tijdschriften en overig drukwerk",464980,"G","Groot- en detailhandel, reparatie van auto’s "
"46499","Groothandel in overige consumentenartikelen (rest, non-food)",464990,"G","Groot- en detailhandel, reparatie van auto’s "
"465","Groothandel in ICT-apparatuur",465000,"G","Groot- en detailhandel, reparatie van auto’s "
"4651","Groothandel in computers, randapparatuur en software",465100,"G","Groot- en detailhandel, reparatie van auto’s "
"4652","Groothandel in elektronische en telecommunicatieapparatuur en bijbehorende onderdelen",465200,"G","Groot- en detailhandel, reparatie van auto’s "
"466","Groothandel in machines, apparaten en toebehoren voor industrie en handel",466000,"G","Groot- en detailhandel, reparatie van auto’s "
"4661","Groothandel in landbouwmachines, werktuigen en tractoren",466100,"G","Groot- en detailhandel, reparatie van auto’s "
"4662","Groothandel in gereedschapswerktuigen",466200,"G","Groot- en detailhandel, reparatie van auto’s "
"4663","Groothandel in machines voor de bouw",466300,"G","Groot- en detailhandel, reparatie van auto’s "
"4664","Groothandel in machines voor de textielindustrie en in naai- en breimachines",466400,"G","Groot- en detailhandel, reparatie van auto’s "
"4665","Groothandel in bedrijfsmeubels",466500,"G","Groot- en detailhandel, reparatie van auto’s "
"4666","Groothandel in kantoormachines (geen computers)",466600,"G","Groot- en detailhandel, reparatie van auto’s "
"4668","Groothandel in machines voor de grafische en voedings- en genotmiddelenindustrie ",466800,"G","Groot- en detailhandel, reparatie van auto’s "
"46681","Groothandel in machines voor de grafische industrie",466810,"G","Groot- en detailhandel, reparatie van auto’s "
"46682","Groothandel in machines voor de voedings- en genotmiddelenindustrie",466820,"G","Groot- en detailhandel, reparatie van auto’s "
"4669","Groothandel in overige machines, apparaten en toebehoren voor industrie en handel ",466900,"G","Groot- en detailhandel, reparatie van auto’s "
"46691","Groothandel in intern transportmaterieel",466910,"G","Groot- en detailhandel, reparatie van auto’s "
"46692","Groothandel in machines en apparaten voor de warmte-, koel- en vriestechniek",466920,"G","Groot- en detailhandel, reparatie van auto’s "
"46693","Groothandel in verbrandingsmotoren, pompen en compressoren",466930,"G","Groot- en detailhandel, reparatie van auto’s "
"46694","Groothandel in appendages, technische toebehoren e.d.",466940,"G","Groot- en detailhandel, reparatie van auto’s "
"46695","Groothandel in meet- en regelapparaten",466950,"G","Groot- en detailhandel, reparatie van auto’s "
"46696","Groothandel in emballage",466960,"G","Groot- en detailhandel, reparatie van auto’s "
"46697","Groothandel in scheepsbenodigdheden en visserij-artikelen",466970,"G","Groot- en detailhandel, reparatie van auto’s "
"46699","Groothandel in overige machines, apparaten en toebehoren voor industrie en handel (rest)",466990,"G","Groot- en detailhandel, reparatie van auto’s "
"467","Overige gespecialiseerde groothandel",467000,"G","Groot- en detailhandel, reparatie van auto’s "
"4671","Groothandel in brandstoffen en overige minerale olieproducten",467100,"G","Groot- en detailhandel, reparatie van auto’s "
"46711","Groothandel in vaste brandstoffen ",467110,"G","Groot- en detailhandel, reparatie van auto’s "
"46712","Groothandel in vloeibare en gasvormige brandstoffen",467120,"G","Groot- en detailhandel, reparatie van auto’s "
"46713","Groothandel in minerale olieproducten (geen brandstoffen)",467130,"G","Groot- en detailhandel, reparatie van auto’s "
"4672","Groothandel in metalen en metaalertsen",467200,"G","Groot- en detailhandel, reparatie van auto’s "
"46721","Groothandel in metaalertsen",467210,"G","Groot- en detailhandel, reparatie van auto’s "
"46722","Groothandel in ferrometalen en -halffabrikaten",467220,"G","Groot- en detailhandel, reparatie van auto’s "
"46723","Groothandel in non-ferrometalen en -halffabrikaten",467230,"G","Groot- en detailhandel, reparatie van auto’s "
"4673","Groothandel in hout, sanitair en overige bouwmaterialen",467300,"G","Groot- en detailhandel, reparatie van auto’s "
"46731","Groothandel in hout en plaatmateriaal",467310,"G","Groot- en detailhandel, reparatie van auto’s "
"46732","Groothandel in verf en verfwaren",467320,"G","Groot- en detailhandel, reparatie van auto’s "
"46733","Groothandel in behang",467330,"G","Groot- en detailhandel, reparatie van auto’s "
"46734","Groothandel in vlakglas",467340,"G","Groot- en detailhandel, reparatie van auto’s "
"46735","Groothandel in zand en grind",467350,"G","Groot- en detailhandel, reparatie van auto’s "
"46736","Groothandel in tegels en plavuizen",467360,"G","Groot- en detailhandel, reparatie van auto’s "
"46737","Groothandel in sanitaire artikelen en sanitair installatiemateriaal ",467370,"G","Groot- en detailhandel, reparatie van auto’s "
"46738","Groothandel gespecialiseerd in overige bouwmaterialen",467380,"G","Groot- en detailhandel, reparatie van auto’s "
"46739","Groothandel in bouwmaterialen algemeen assortiment ",467390,"G","Groot- en detailhandel, reparatie van auto’s "
"4674","Groothandel in ijzer- en metaalwaren en verwarmingsapparaten",467400,"G","Groot- en detailhandel, reparatie van auto’s "
"46741","Groothandel in ijzer- en metaalwaren",467410,"G","Groot- en detailhandel, reparatie van auto’s "
"46742","Groothandel in verwarmingsapparaten",467420,"G","Groot- en detailhandel, reparatie van auto’s "
"4675","Groothandel in chemische producten",467500,"G","Groot- en detailhandel, reparatie van auto’s "
"46751","Groothandel in chemische grondstoffen en chemicaliën voor industriële toepassing",467510,"G","Groot- en detailhandel, reparatie van auto’s "
"46752","Groothandel in bestrijdingsmiddelen en meststoffen",467520,"G","Groot- en detailhandel, reparatie van auto’s "
"4676","Groothandel in overige intermediaire producten",467600,"G","Groot- en detailhandel, reparatie van auto’s "
"46761","Groothandel in textielgrondstoffen en -halffabrikaten",467610,"G","Groot- en detailhandel, reparatie van auto’s "
"46762","Groothandel in papier en karton",467620,"G","Groot- en detailhandel, reparatie van auto’s "
"46769","Groothandel in overige intermediaire producten (rest)",467690,"G","Groot- en detailhandel, reparatie van auto’s "
"4677","Groothandel in afval en schroot",467700,"G","Groot- en detailhandel, reparatie van auto’s "
"46771","Groothandel in autosloopmateriaal",467710,"G","Groot- en detailhandel, reparatie van auto’s "
"46772","Groothandel in ijzer- en staalschroot en oude non-ferrometalen",467720,"G","Groot- en detailhandel, reparatie van auto’s "
"46779","Groothandel in overige oude materialen en afvalstoffen",467790,"G","Groot- en detailhandel, reparatie van auto’s "
"469","Niet-gespecialiseerde groothandel",469000,"G","Groot- en detailhandel, reparatie van auto’s "
"4690","Niet-gespecialiseerde groothandel",469000,"G","Groot- en detailhandel, reparatie van auto’s "
"46901","Niet-gespecialiseerde groothandel in consumentenartikelen",469010,"G","Groot- en detailhandel, reparatie van auto’s "
"46902","Niet-gespecialiseerde groothandel in niet-consumentenartikelen",469020,"G","Groot- en detailhandel, reparatie van auto’s "
"47","Detailhandel (niet in auto's)",470000,"G","Groot- en detailhandel, reparatie van auto’s "
"471","Supermarkten, warenhuizen en dergelijke winkels met een algemeen assortiment",471000,"G","Groot- en detailhandel, reparatie van auto’s "
"4711","Supermarkten en dergelijke winkels met een algemeen assortiment voedings- en genotmiddelen",471100,"G","Groot- en detailhandel, reparatie van auto’s "
"4719","Warenhuizen en dergelijke winkels met een algemeen assortiment non-food",471900,"G","Groot- en detailhandel, reparatie van auto’s "
"47191","Warenhuizen",471910,"G","Groot- en detailhandel, reparatie van auto’s "
"47192","Winkels met een algemeen assortiment non-food (geen warenhuizen)",471920,"G","Groot- en detailhandel, reparatie van auto’s "
"472","Gespecialiseerde winkels in voedings- en genotmiddelen ",472000,"G","Groot- en detailhandel, reparatie van auto’s "
"4721","Winkels in aardappelen, groenten en fruit ",472100,"G","Groot- en detailhandel, reparatie van auto’s "
"4722","Winkels in vlees en vleeswaren, wild en gevogelte ",472200,"G","Groot- en detailhandel, reparatie van auto’s "
"47221","Winkels in vlees en vleeswaren",472210,"G","Groot- en detailhandel, reparatie van auto’s "
"47222","Winkels in wild en gevogelte",472220,"G","Groot- en detailhandel, reparatie van auto’s "
"4723","Winkels in vis",472300,"G","Groot- en detailhandel, reparatie van auto’s "
"4724","Winkels in brood, banket, chocolade en suikerwerk ",472400,"G","Groot- en detailhandel, reparatie van auto’s "
"47241","Winkels in brood en banket",472410,"G","Groot- en detailhandel, reparatie van auto’s "
"47242","Winkels in chocolade en suikerwerk",472420,"G","Groot- en detailhandel, reparatie van auto’s "
"4725","Winkels in dranken",472500,"G","Groot- en detailhandel, reparatie van auto’s "
"4726","Winkels in tabaksproducten",472600,"G","Groot- en detailhandel, reparatie van auto’s "
"4729","Gespecialiseerde winkels in overige voedings- en genotmiddelen ",472900,"G","Groot- en detailhandel, reparatie van auto’s "
"47291","Winkels in kaas",472910,"G","Groot- en detailhandel, reparatie van auto’s "
"47292","Winkels in natuurvoeding en reformartikelen",472920,"G","Groot- en detailhandel, reparatie van auto’s "
"47293","Winkels in buitenlandse voedingsmiddelen",472930,"G","Groot- en detailhandel, reparatie van auto’s "
"47299","Gespecialiseerde winkels in overige voedings- en genotmiddelen (rest)",472990,"G","Groot- en detailhandel, reparatie van auto’s "
"473","Benzinestations",473000,"G","Groot- en detailhandel, reparatie van auto’s "
"4730","Benzinestations",473000,"G","Groot- en detailhandel, reparatie van auto’s "
"474","Winkels in consumentenelektronica",474000,"G","Groot- en detailhandel, reparatie van auto’s "
"4741","Winkels in computers, randapparatuur en software",474100,"G","Groot- en detailhandel, reparatie van auto’s "
"4742","Winkels in telecommunicatieapparatuur ",474200,"G","Groot- en detailhandel, reparatie van auto’s "
"4743","Winkels in audio- en videoapparatuur of in een algemeen assortiment van wit- en  bruingoed",474300,"G","Groot- en detailhandel, reparatie van auto’s "
"47431","Winkels in audio- en videoapparatuur",474310,"G","Groot- en detailhandel, reparatie van auto’s "
"47432","Winkels in een algemeen assortiment van wit- en bruingoed ",474320,"G","Groot- en detailhandel, reparatie van auto’s "
"475","Winkels in overige huishoudelijke artikelen",475000,"G","Groot- en detailhandel, reparatie van auto’s "
"4751","Winkels in kledingstoffen, huishoudtextiel en fournituren ",475100,"G","Groot- en detailhandel, reparatie van auto’s "
"47511","Winkels in kledingsstoffen",475110,"G","Groot- en detailhandel, reparatie van auto’s "
"47512","Winkels in  huishoudtextiel",475120,"G","Groot- en detailhandel, reparatie van auto’s "
"47513","Winkels in breiwol, handwerken en fournituren",475130,"G","Groot- en detailhandel, reparatie van auto’s "
"4752","Winkels in doe-het-zelfartikelen",475200,"G","Groot- en detailhandel, reparatie van auto’s "
"47521","Winkels in ijzerwaren en gereedschappen",475210,"G","Groot- en detailhandel, reparatie van auto’s "
"47522","Winkels in verf, verfwaren en behang",475220,"G","Groot- en detailhandel, reparatie van auto’s "
"47523","Winkels in houten bouw- en tuinmaterialen",475230,"G","Groot- en detailhandel, reparatie van auto’s "
"47524","Winkels in tegels",475240,"G","Groot- en detailhandel, reparatie van auto’s "
"47525","Winkels in keukens",475250,"G","Groot- en detailhandel, reparatie van auto’s "
"47526","Winkels in parket-, laminaat- en kurkvloeren",475260,"G","Groot- en detailhandel, reparatie van auto’s "
"47527","Winkels gespecialiseerd in overige doe-het-zelfartikelen",475270,"G","Groot- en detailhandel, reparatie van auto’s "
"47528","Bouwmarkten en andere winkels in bouwmaterialen algemeen assortiment",475280,"G","Groot- en detailhandel, reparatie van auto’s "
"4753","Winkels in vloerbedekking en gordijnen ",475300,"G","Groot- en detailhandel, reparatie van auto’s "
"4754","Winkels in elektrische huishoudelijke apparatuur en onderdelen daarvoor",475400,"G","Groot- en detailhandel, reparatie van auto’s "
"47541","Winkels in witgoed",475410,"G","Groot- en detailhandel, reparatie van auto’s "
"47542","Winkels in naai- en breimachines",475420,"G","Groot- en detailhandel, reparatie van auto’s "
"47543","Winkels in overige elektrische huishoudelijke apparatuur",475430,"G","Groot- en detailhandel, reparatie van auto’s "
"47544","Winkels in onderdelen voor elektrische huishoudelijke apparatuur",475440,"G","Groot- en detailhandel, reparatie van auto’s "
"4759","Winkels in meubels, verlichting en overige huishoudelijke artikelen (rest)",475900,"G","Groot- en detailhandel, reparatie van auto’s "
"47591","Winkels in meubels",475910,"G","Groot- en detailhandel, reparatie van auto’s "
"47592","Winkels in verlichtingsartikelen",475920,"G","Groot- en detailhandel, reparatie van auto’s "
"47593","Winkels in artikelen voor woninginrichting algemeen assortiment",475930,"G","Groot- en detailhandel, reparatie van auto’s "
"47594","Winkels in muziekinstrumenten",475940,"G","Groot- en detailhandel, reparatie van auto’s "
"47595","Winkels in glas-, porselein- en aardewerk",475950,"G","Groot- en detailhandel, reparatie van auto’s "
"47596","Winkels gespecialiseerd in overige huishoudelijke artikelen (rest)",475960,"G","Groot- en detailhandel, reparatie van auto’s "
"47597","Winkels in huishoudelijke artikelen algemeen assortiment",475970,"G","Groot- en detailhandel, reparatie van auto’s "
"476","Winkels in lectuur, sport-, kampeer- en recreatie-artikelen",476000,"G","Groot- en detailhandel, reparatie van auto’s "
"4761","Winkels in boeken ",476100,"G","Groot- en detailhandel, reparatie van auto’s "
"4762","Winkels in kranten, tijdschriften en kantoorbehoeften ",476200,"G","Groot- en detailhandel, reparatie van auto’s "
"4763","Winkels in audio- en video-opnamen",476300,"G","Groot- en detailhandel, reparatie van auto’s "
"4764","Winkels in fietsen en bromfietsen, sport- en kampeerartikelen en boten ",476400,"G","Groot- en detailhandel, reparatie van auto’s "
"47641","Winkels in fietsen en bromfietsen",476410,"G","Groot- en detailhandel, reparatie van auto’s "
"47642","Winkels in watersportartikelen",476420,"G","Groot- en detailhandel, reparatie van auto’s "
"47643","Winkels in sportartikelen (geen watersport)",476430,"G","Groot- en detailhandel, reparatie van auto’s "
"47644","Winkels in kampeerartikelen (geen caravans)",476440,"G","Groot- en detailhandel, reparatie van auto’s "
"4765","Winkels in speelgoed",476500,"G","Groot- en detailhandel, reparatie van auto’s "
"477","Winkels in overige artikelen",477000,"G","Groot- en detailhandel, reparatie van auto’s "
"4771","Winkels in kleding en mode-artikelen; textielsupermarkten",477100,"G","Groot- en detailhandel, reparatie van auto’s "
"47711","Winkels in herenkleding ",477110,"G","Groot- en detailhandel, reparatie van auto’s "
"47712","Winkels in dameskleding ",477120,"G","Groot- en detailhandel, reparatie van auto’s "
"47713","Winkels in bovenkleding en mode-artikelen (algemeen assortiment) ",477130,"G","Groot- en detailhandel, reparatie van auto’s "
"47714","Winkels in baby- en kinderkleding",477140,"G","Groot- en detailhandel, reparatie van auto’s "
"47715","Winkels in babyartikelen algemeen assortiment",477150,"G","Groot- en detailhandel, reparatie van auto’s "
"47716","Winkels in onderkleding, foundations e.d.",477160,"G","Groot- en detailhandel, reparatie van auto’s "
"47717","Winkels in mode-artikelen",477170,"G","Groot- en detailhandel, reparatie van auto’s "
"47718","Textielsupermarkten",477180,"G","Groot- en detailhandel, reparatie van auto’s "
"4772","Winkels in schoenen en lederwaren ",477200,"G","Groot- en detailhandel, reparatie van auto’s "
"47721","Winkels in schoenen",477210,"G","Groot- en detailhandel, reparatie van auto’s "
"47722","Winkels in lederwaren en reisartikelen",477220,"G","Groot- en detailhandel, reparatie van auto’s "
"4773","Apotheken",477300,"G","Groot- en detailhandel, reparatie van auto’s "
"4774","Winkels in drogisterij-, medische en orthopedische artikelen",477400,"G","Groot- en detailhandel, reparatie van auto’s "
"47741","Winkels in drogisterij-artikelen ",477410,"G","Groot- en detailhandel, reparatie van auto’s "
"47742","Winkels in medische en orthopedische artikelen",477420,"G","Groot- en detailhandel, reparatie van auto’s "
"4775","Winkels in parfums en cosmetica",477500,"G","Groot- en detailhandel, reparatie van auto’s "
"4776","Winkels in bloemen, planten, zaden, tuinbenodigdheden, huisdieren en dierbenodigdheden ",477600,"G","Groot- en detailhandel, reparatie van auto’s "
"47761","Winkels in bloemen en planten, zaden en tuinbenodigdheden",477610,"G","Groot- en detailhandel, reparatie van auto’s "
"47762","Tuincentra",477620,"G","Groot- en detailhandel, reparatie van auto’s "
"47763","Winkels in dieren, dierbenodigdheden en hengelsportartikelen",477630,"G","Groot- en detailhandel, reparatie van auto’s "
"4777","Winkels in juweliersartikelen en uurwerken ",477700,"G","Groot- en detailhandel, reparatie van auto’s "
"4778","Winkels in overige artikelen (rest)",477800,"G","Groot- en detailhandel, reparatie van auto’s "
"47781","Winkels in fotografische artikelen",477810,"G","Groot- en detailhandel, reparatie van auto’s "
"47782","Winkels in optische artikelen",477820,"G","Groot- en detailhandel, reparatie van auto’s "
"47783","Winkels in schilderijen, lijsten, prenten, kunstvoorwerpen en religieuze artikelen",477830,"G","Groot- en detailhandel, reparatie van auto’s "
"47789","Winkels gespecialiseerd in overige artikelen (rest)",477890,"G","Groot- en detailhandel, reparatie van auto’s "
"4779","Winkels in antiek en tweedehands goederen ",477900,"G","Groot- en detailhandel, reparatie van auto’s "
"47791","Winkels in antiek",477910,"G","Groot- en detailhandel, reparatie van auto’s "
"47792","Winkels in tweedehands kleding",477920,"G","Groot- en detailhandel, reparatie van auto’s "
"47793","Winkels in tweedehands goederen (geen kleding)",477930,"G","Groot- en detailhandel, reparatie van auto’s "
"478","Markthandel",478000,"G","Groot- en detailhandel, reparatie van auto’s "
"4781","Markthandel in voedings- en genotmiddelen",478100,"G","Groot- en detailhandel, reparatie van auto’s "
"47811","Markthandel in aardappelen, groenten en fruit",478110,"G","Groot- en detailhandel, reparatie van auto’s "
